{
  "approved_spark_conf": [
    "spark.executor.memory",
    "spark.executor.cores",
    "spark.executor.instances",
    "spark.executor.memoryOverhead",
    "spark.driver.memory",
    "spark.driver.cores",
    "spark.driver.maxResultSize",
    "spark.cores.max",
    "spark.default.parallelism",
    "spark.sql.*",
    "spark.dynamicAllocation.*",
    "spark.serializer",
    "spark.kryoserializer.*",
    "spark.sql.shuffle.partitions",
    "spark.memory.*",
    "spark.speculation*",
    "spark.task.*",
    "spark.hadoop.fs.*",
    "spark.hadoop.parquet.*",
    "spark.hadoop.mapreduce.*",
    "spark.databricks.delta.*",
    "spark.delta.*",
    "spark.pyspark.*",
    "spark.executorEnv.*",
    "spark.ui.*",
    "spark.eventLog.*",
    "spark.files.*",
    "spark.network.timeout",
    "spark.rpc.*"
  ],
  "arch": [
    "x86_64",
    "aarch64"
  ],
  "build_packages": [
    {
      "hashes": [
        "d7193f7c8e4e93f444fde0262bf90af30e16fa0ad0ad44cb553c87339b23cd1c"
      ],
      "name": "packaging",
      "version": "26.3"
    },
    {
      "hashes": [
        "95b30ddfb717250edb492926c92b5221f7ef3fbcc2b07579bcd4a27da21d0173"
      ],
      "name": "setuptools",
      "version": "80.10.2"
    },
    {
      "hashes": [
        "3217dcc807155e45db462d7ef2431f5ddda0d7273b700d05a67b271ceb1287ab"
      ],
      "name": "wheel",
      "version": "0.48.0"
    }
  ],
  "delta": {
    "version": "3.2.0"
  },
  "description": "Legacy runtime aligned to Spark 3.5 / Delta 3.2 / Java 11 / Scala 2.12 / Python 3.11 for notebooks that have not moved to the 2.0 family.",
  "family": "fabric-1.3-compatible",
  "iceberg": {
    "version": "1.11.0"
  },
  "id": "olcf-rt-1.3.0",
  "jars": [
    {
      "coordinate": "io.delta:delta-spark_2.12:3.2.0",
      "group": "core"
    },
    {
      "coordinate": "io.delta:delta-storage:3.2.0",
      "group": "core"
    },
    {
      "coordinate": "org.apache.hadoop:hadoop-azure:${hadoop.version}",
      "group": "core"
    },
    {
      "coordinate": "org.apache.hadoop:hadoop-aws:${hadoop.version}",
      "group": "s3",
      "optional": true
    },
    {
      "coordinate": "org.apache.iceberg:iceberg-spark-runtime-3.5_2.12:1.11.0",
      "group": "iceberg",
      "optional": true
    }
  ],
  "java": {
    "major": 11,
    "supported": [
      8,
      11,
      17
    ]
  },
  "os": [
    "linux",
    "macos",
    "windows"
  ],
  "packages": [
    {
      "hashes": [
        "6fe0c04218aab65c54c4ff81638cdbf848d89f5653b74d68638a137f200dd16e"
      ],
      "marker": "sys_platform == 'darwin'",
      "name": "appnope",
      "version": "1.0.0"
    },
    {
      "hashes": [
        "9da13157f5b28becde0bd374fc677dcd3c290614264eff096f167c469cd9f933"
      ],
      "name": "asttokens",
      "version": "3.0.2"
    },
    {
      "hashes": [
        "c647aa4a12dfbad9333ca4e71fe62ddc36f4e63b2d260a37a8b83d2f043ac309"
      ],
      "name": "attrs",
      "version": "26.1.0"
    },
    {
      "hashes": [
        "62f22742b58a1a33014a2b6b706588a8d7e2a88ae7bd1a6ebe8c992928483775"
      ],
      "name": "certifi",
      "version": "2026.7.22"
    },
    {
      "hashes": [
        "3311ed60d36f83378794e1009ac6258bafbf81f7888b4caa7b35a521e3f95813",
        "34e261f78cb6ceaaa36f42f2613f4380d94d9c759a9c73c769ee6e0247364632",
        "398aff33cee2767e3e781d2554c54bd0dff386bb437581e0d8011fde1a942ec1",
        "42f6930c31dc7f50732c9ae793c2786c7b6b044195967bbdde40bb9be81c4cc0",
        "c7659f22557c5a0bc4855cd635f55edec690cc008a40768527762cb9fb263455",
        "c8d2c9fd1f2d16f780d15127abb050d13d1a76c03a4bd87d7e4980e45e511e12"
      ],
      "marker": "implementation_name == 'pypy'",
      "name": "cffi",
      "version": "2.1.1"
    },
    {
      "hashes": [
        "1c50fe28bbc2ced33386f298650d91218076c05420e6cbd790b913adc41659e7",
        "211d5a3eb6af8f513b8d4ca19a8c1b7accab1b5f0d3175f9826b03c1a920dc1f",
        "254eb48b9fa5ee9898a3c445825a1f340fe53712a098904b39b0bddba8ea3cb1",
        "3d21b8b13c7592db2ac5e544a6d83187b995257472b0c9e8351b6d507ae37ed6",
        "40ab6bffa02ae10a0581e6c198be7d2d8ca5c2a0c64e4ed3465d766df457573e",
        "4275811936e2f06feff5e598fb42a1b7ae852da8e39605211892b56b81a34efd",
        "87e50a3e7cb90af586b6c5faf23e302a970415ac73bd7bd90a515a04b427ef96",
        "9f56f72050826f63dcee7a7f55b0a77168cb3bfc553fd405e7f8f9ece75a4036",
        "b6b751274acb69d77b3323d6b7dbaa3c7fdfc1eb829b7eb61d262f32e1af9685",
        "d19fbd981a488e22cd04883659ca6b08f50b5974f9fd7c95655ef6a043e5893f",
        "d760fe2a4d7c3b226cb9026d6a842868d52a7901bd98420e1baf14e80da85cf5"
      ],
      "name": "charset-normalizer",
      "version": "3.5.2"
    },
    {
      "hashes": [
        "4f1d9991f5acc0ca119f9d443620b77f9d6b33703e51011c16baf57afb285fc6"
      ],
      "marker": "sys_platform == 'win32'",
      "name": "colorama",
      "version": "0.4.6"
    },
    {
      "hashes": [
        "c615d91d75f7f04f095b30d1c1711babd43bdc6419c1be9886a85f2f4e489417"
      ],
      "name": "comm",
      "version": "0.2.3"
    },
    {
      "hashes": [
        "192b73e8d53bbd60225220c0943627bf249ac93d0ea3090e23c45f3e0ceb6a35",
        "1e76339d5510bc17e9181dba9577508afcb21aad5728f1a55ef74d7d97d255f3",
        "66e4ac3d6e7026e83e7d93d7ee2f51dd4a4e8dff673578d424e60796893e5b2c",
        "a9e9d3550e15ca479c59333e90845029190531f0cacfedab3b815a57bd913947"
      ],
      "name": "debugpy",
      "version": "1.8.22"
    },
    {
      "hashes": [
        "c4ff3fa7218e58a702cb71eb64384b0005c4d6f0bbdd0fe0b38a53564d946e09"
      ],
      "name": "delta-spark",
      "version": "3.2.0"
    },
    {
      "hashes": [
        "760643d3452b4d777d295bb167ccc74c64a81df23fb5e08eff250c425a4b2017"
      ],
      "name": "executing",
      "version": "2.2.1"
    },
    {
      "hashes": [
        "0fb3915616adac85ccfdd737d26be1089845d2019819505b42d39888458f74d4"
      ],
      "name": "fastjsonschema",
      "version": "2.22.2"
    },
    {
      "hashes": [
        "ab7ae7122974553370f0bdb919e1a960b2cd1bc1ef0276416d896db81c14582c"
      ],
      "name": "idna",
      "version": "3.20"
    },
    {
      "hashes": [
        "bba5600596a7e21f3eef53281cf28d6a5195634d2f2b78ff9501a3272c6eaab0"
      ],
      "name": "importlib-metadata",
      "version": "9.0.1"
    },
    {
      "hashes": [
        "a6757f790ddc5a6006b813d82da1a9dbb65b3a00f2b6607df776418c6566ec1c"
      ],
      "name": "ipykernel",
      "version": "7.4.0"
    },
    {
      "hashes": [
        "6d1645743cfd1a07eb695d85aa2b5fa66721f8cbae9431d4049f7084bbf06509"
      ],
      "name": "ipython",
      "version": "9.17.1"
    },
    {
      "hashes": [
        "a9462224a505ade19a605f71f8fa63c2048833ce50abc86768a0d81d876dc81c"
      ],
      "name": "ipython-pygments-lexers",
      "version": "1.1.1"
    },
    {
      "hashes": [
        "7bdd9c2634f56713299976f4cbd59cb3fa92165cc5e05ea811fb253480728b67"
      ],
      "name": "jedi",
      "version": "0.20.0"
    },
    {
      "hashes": [
        "d489f15263b8d200f8387e64b4c3a75f06629559fb73deb8fdfb525f2dab50ce"
      ],
      "name": "jsonschema",
      "version": "4.26.0"
    },
    {
      "hashes": [
        "98802fee3a11ee76ecaca44429fda8a41bff98b00a0f2838151b113f210cc6fe"
      ],
      "name": "jsonschema-specifications",
      "version": "2025.9.1"
    },
    {
      "hashes": [
        "5f73f24f22fa25192cfff6b23c051932a2473a797b05734aff495b392103e14e"
      ],
      "name": "jupyter-client",
      "version": "8.10.0"
    },
    {
      "hashes": [
        "ebf87fdc6073d142e114c72c9e29a9d7ca03fad818c5d300ce2adc1fb0743407"
      ],
      "name": "jupyter-core",
      "version": "5.9.1"
    },
    {
      "hashes": [
        "3c821cf1c209f59fb2d2d64abbf5b23b67bcb2210d663f9918dd851c6da1fcf6"
      ],
      "name": "matplotlib-inline",
      "version": "0.2.2"
    },
    {
      "hashes": [
        "cc6698fa75f4fab8755ead786317815f13a6fee3b53311c0abb1a8b51d52f7ec"
      ],
      "name": "nbformat",
      "version": "5.11.1"
    },
    {
      "hashes": [
        "2bc87bdca654e719425145f5e84eaeb0080b013fdd47d65729a7d66243f4987c"
      ],
      "name": "nest-asyncio2",
      "version": "1.7.3"
    },
    {
      "hashes": [
        "2a02aba9ed12e4ac4eb3ea9421c420301a0c6460d9830d74a9df87efa4912010",
        "4c66707fabe114439db9068ee468c26bbdf909cac0fb58686a42a24de1760c71",
        "666dbfb6ec68962c033a450943ded891bed2d54e6755e35e5835d63f4f6931d5",
        "7ab55401287bfec946ced39700c053796e7cc0e3acbef09993a9ad2adba6ca6e",
        "cd25bcecc4974d09257ffcd1f098ee778f7834c3ad767fe5db785be9a4aa9cb2",
        "edd8b5fe47dab091176d21bb6de568acdd906d1887a4584a15a9a96a1dca06ef"
      ],
      "name": "numpy",
      "version": "1.26.4"
    },
    {
      "hashes": [
        "d7193f7c8e4e93f444fde0262bf90af30e16fa0ad0ad44cb553c87339b23cd1c"
      ],
      "name": "packaging",
      "version": "26.3"
    },
    {
      "hashes": [
        "3fc6873a41186404dad67245896a6e440baacc92f5b716ccd1bc9ed2995ab2c5",
        "4f18ba62b61d7e192368b84517265a99b4d7ee8912f8708660fb4a366cc82667",
        "66108071e1b935240e74525006034333f98bcdb87ea116de573a6a0dccb6c039",
        "7c2875855b0ff77b2a64a0365e24455d9990730d6431b9e0ee18ad8acee13dbd",
        "c124333816c3a9b03fbeef3a9f230ba9a737e9e5bb4060aa2107a86cc0a497fc",
        "cd8d0c3be0515c12fed0bdbae072551c8b54b7192c7b1fda0ba56059a0179698"
      ],
      "name": "pandas",
      "version": "2.2.3"
    },
    {
      "hashes": [
        "a8926eb2a1b915486941fdbd31e86a4baf88fe8c210f25f2f35ecec5b574ca1c"
      ],
      "name": "parso",
      "version": "0.8.7"
    },
    {
      "hashes": [
        "7236d1e080e4936be2dc3e326cec0af72acf9212a7e1d060210e70a47e253523"
      ],
      "marker": "sys_platform != 'emscripten' and sys_platform != 'win32'",
      "name": "pexpect",
      "version": "4.9.0"
    },
    {
      "hashes": [
        "080f3b39423b5abfca9a23d84c4e9795f54d395cd8459867a8ded44084fcd5f8"
      ],
      "name": "platformdirs",
      "version": "4.12.3"
    },
    {